{
  "$schema": "https://json-schema.org/draft/2020-12/schema",
  "$id": "urn:fomod-logger:schema:choices-file:1",
  "title": "Modlist Companion choices file",
  "description": "Every FOMOD choice in a mod list, by name, written by Export choices file and read by Import choices file. Choices are matched to an installer by step, group and option name (never by id), so a mod update that reorders options still lines up. Fields this version does not know are ignored when importing.",
  "type": "object",
  "required": ["format", "format_version", "mods"],
  "properties": {
    "format": { "const": "fomod-companion-choices" },
    "format_version": {
      "description": "A file with a higher version than the importing build understands is refused.",
      "type": "integer",
      "minimum": 1,
      "maximum": 1
    },
    "exported_at": { "type": "string", "maxLength": 1000 },
    "source": {
      "type": "object",
      "properties": {
        "game": { "description": "The game the list is for, as MO2 names it.", "type": "string", "maxLength": 1000 },
        "nexus_domain": {
          "description": "The game's Nexus Mods address name, used to build links in the install guide.",
          "type": "string",
          "maxLength": 1000
        },
        "instance_label": { "description": "Folder name of the MO2 instance it came from.", "type": "string", "maxLength": 1000 }
      }
    },
    "mods": {
      "description": "The newest install of each mod that was installed, in name order.",
      "type": "array",
      "maxItems": 5000,
      "items": { "$ref": "#/$defs/mod" }
    }
  },
  "$defs": {
    "mod": {
      "type": "object",
      "required": ["name", "steps"],
      "properties": {
        "name": { "description": "The mod's name in MO2.", "type": "string", "minLength": 1, "maxLength": 1000, "pattern": "\\S" },
        "nexus_id": { "description": "0 when not known.", "type": "integer", "minimum": 0, "maximum": 9223372036854775807 },
        "version": { "type": "string", "maxLength": 1000 },
        "archive": { "description": "File name (no folder) of the archive it was installed from.", "type": "string", "maxLength": 1000 },
        "installed_at": { "type": "string", "maxLength": 1000 },
        "steps": { "type": "array", "maxItems": 500, "items": { "$ref": "#/$defs/step" } }
      }
    },
    "step": {
      "type": "object",
      "required": ["name", "groups"],
      "properties": {
        "name": { "type": "string", "maxLength": 1000 },
        "skipped": {
          "description": "True when the installer did not show this page, so nothing on it was chosen.",
          "type": "boolean"
        },
        "groups": { "type": "array", "maxItems": 1000, "items": { "$ref": "#/$defs/group" } }
      }
    },
    "group": {
      "type": "object",
      "required": ["name", "options"],
      "properties": {
        "name": { "type": "string", "maxLength": 1000 },
        "type": {
          "description": "The FOMOD group rule. Informational: when replaying, the installer's own rule decides.",
          "enum": ["", "SelectAtLeastOne", "SelectAtMostOne", "SelectExactlyOne", "SelectAny", "SelectAll"]
        },
        "options": { "type": "array", "maxItems": 20000, "items": { "$ref": "#/$defs/option" } }
      }
    },
    "option": {
      "type": "object",
      "required": ["name", "picked"],
      "properties": {
        "name": { "type": "string", "maxLength": 1000 },
        "picked": { "type": "boolean" },
        "enabled": {
          "description": "False when the FOMOD forced or blocked this option, so it was not the user's choice (default true).",
          "type": "boolean"
        }
      }
    }
  }
}
